,text,search_term,label0
2384,"Part of a Starbucks location in McHenry, Illinois, collapsed after a pickup truck crashed into the building ",Starbucks,1
2388,"Oil prices may not be spiking in response to last week’s airstrike in Iraq, but the ongoing tensions in the Middle East will support higher oil prices going forward, Marathon Oil CEO Lee Tillman said earlier today. ",Marathon Oil,1
2389,"Middle East tensions have put a floor under oil prices, says Marathon Oil CEO ",Marathon Oil,1
2390,"Uddhav Thackeray can't be blamed for Sai Baba row, says Sena ",BABA,0
2391,Devotees visit Sai Baba temple in Maharashtra's #Shirdi amid bandh called today after CM Uddhav Thackeray's remarks on Sai Baba's birthplace. (Images: ANI) More on ,BABA,0
2392,Sai Baba temple to remain open amid indefinite Shirdi shutdown from today. ,BABA,0
2393,Shirdi to remain shut indefinitely from Sunday amid row over Sai Baba's birthplace. ,BABA,0
2394,#Alibaba twins: Jack Ma #doppelganger spotted at grocery store,Alibaba,1
2395,"Three of China’s biggest technology companies — Baidu, Alibaba and Tencent — have had mixed fortunes in 2019.",Alibaba,1
2397,"Cashless, keyless and full of robots — Alibaba’s hotel is straight out of the future. (via @CNBCi)",Alibaba,1
2401,Alibaba praised by China's gay community for ad recognizing same-sex couples ,Alibaba,1
2403,Alibaba undercuts Amazon in Europe to woo wary brands ,Alibaba,1
2411,"Jack Ma, Alibaba founder and China's richest man, has donated 100 million yuan ($14.4 million) through his foundation to help find a vaccine for the Wuhan coronavirus.",Alibaba,1
2412,Coca-Cola refuses to scrap plastic bottles ,Coca-Cola,1
2415,"Final GDP, Amazon and Coca-Cola earnings: 3 things to watch for in the markets on Thursday",Coca-Cola,1
2417,Coca-Cola CEO: Consumer spending is 'robust' heading into 2020,Coca-Cola,1
2418,"“The objective is not no plastics, it’s zero waste.” Coca-Cola CEO James Quincey talks sustainability, growth and the consumer with the @SquawkCNBC team. #Davos2020",Coca-Cola,1
2419,Here's why stocks such as Procter & Gamble and Coca-Cola are still included in ESG ETFs $USSG $SUSL (via @ETFEdgeCNBC),Coca-Cola,1
2421,"Coca-Cola shares rise after Credit Suisse upgrades the stock, predicts 20% rally",Coca-Cola,1
2424,"Medtronic, Coca-Cola and IBM are among the businesses that raised an unprecedented $113.5 billion from so-called reverse Yankee bonds in 2019",Coca-Cola,1
2425,"Weedkiller wars: Roundup, the world's No. 1 herbicide, is in a clash of agribusiness rivals as fierce as Pepsi’s showdown with Coca-Cola",Coca-Cola,1
2426,"Coke, Fuze tea demand drive Coca-Cola's quarterly revenue beat ",Coca-Cola,1
2428,Egypt signs two Mediterranean deals with Exxon Mobil: ministry ,Exxon Mobil,1
2429,ExxonMobil says its French Fos refinery shipments disrupted due to strike ,Exxon Mobil,1
2431,JetBlue plans to go completely carbon neutral on all U.S. flights ,JetBlue,1
2432,JetBlue announces plan to become first carbon-neutral U.S. airline in six months ,JetBlue,1
2433,JetBlue resets cost structure to enable low airfares for next decade ,JetBlue,1
2434,JetBlue to become carbon neutral in 2020,JetBlue,1
2436,"JetBlue Airways is hiking its checked baggage fees for the second time in two years. Passengers will have to pay $35 for their first checked bag, up from $30. A second checked bag will cost $45, up from $40.",JetBlue,1
2439,"If Amazon issues this warning in earnings, 'watch out below,' trader warns $AMZN (via @TradingNation)",AMZN,1
2441,"From making cars talk using Alexa’s voice to managing data from factories full of robots, Amazon wants a big piece of the action in transportation, and next week at #CES2020 will unveil more about its strategy to achieve that goal than ever before",AMZN,1
2442,Amazon to showcase its transportation drive at the world's largest tech show #CES2020,AMZN,1
2443,The front page of tomorrow's Daily Telegraph: 'Saudi crown prince tried to 'intimidate' Amazon chief' #TomorrowsPapersToday,Amazon,0
2444,"Delivering Amazon packages to doorsteps as quickly as promised is no easy feat. Delivery drivers tell CBC News the hustle required pushes them to prioritize speed, sometimes at the expense of safety. ",Amazon,1
2448,Amazon promises to create 1m jobs in India as Jeff Bezos trip descends into PR nightmare,Amazon,1
2449,The 25 best original TV shows to watch on Amazon Prime,Amazon,0
2453,The 20 best Amazon Prime TV shows to watch in the UK,Amazon,0
2456,Amazon 'threatens to fire' employees for campaigning against climate change ,Amazon,1
2457,Amazon driver refuses to deliver bottle of sherry to 92-year-old woman without ID,Amazon,1
2458,'@amazon under fire for selling anti-Semitic children’s books ,Amazon,1
2459,#Pakisan Science Minister under fire for bizarre pitch to Netflix &amp; Amazon ,Amazon,1
2460,"ICYMI: Saudis hack #Bezos - If #Amazon tech genius falls for #WhatsApp scam, what chance do the rest of us have? WATCH: ",Amazon,1
2462,‘Jeff #Bezos Go Back’: Indian business owners protest against #Amazon’s expansion in the country ,Amazon,1
2463,Thousands took to the streets in #India to protest #Amazon's decision to expand into the country MORE: ,Amazon,1
2464,"Indian commerce minister is reportedly not going to meet #Amazon CEO Jeff #Bezos, who is currently visiting the country",Amazon,1
2467,Guardian front page 23.01.20: UN demands inquiry into 'hacking' of Amazon boss,Amazon,1
2468,Bezos hack: UN to address alleged Saudi hacking of Amazon boss's phone ,Amazon,1
2469,Amazon boss Jeff Bezos's phone 'hacked by Saudi crown prince' ,Amazon,1
2471,'It's a food forest': Amazon villagers face down Bolsonaro threat ,Amazon,0
2473,"On Friday, French luxury goods magnate Bernard Arnault briefly toppled Amazon’s Jeff Bezos to become the richest person in the world . @SophieTheGorman has more on the man who in 2019 earned about €66,700 a minute",Amazon,1
2474,Jeff Bezos' net worth jumps by over $12 billion after Amazon's big quarter,Amazon,1
2475,"Amazon reported $6.47 earnings per share and $87.44 in revenue in Q4, smashing expectations of $4.03 per share and $86.02 billion, respectively.",Amazon,1
2476,Amazon soars after a huge earnings beat. ,Amazon,1
2478,Amazon slated to report fourth-quarter earnings after the bell ,Amazon,1
2479,"UPS CEO David Abney sees Amazon as both a customer and a competitor. “We monitor that,” he says. ",Amazon,1
2480,New for subscribers: Here's what every major analyst predicts for Amazon's earnings report after the bell ,Amazon,1
2481,Options traders bet on a post-earnings pop for Amazon ,Amazon,1
2482,UPS chief executive: Amazon as a major client and competitor in delivery is not a problem for us ,Amazon,1
2484,Amazon's spending on one-day delivery is likely to weigh on fourth-quarter profit ,Amazon,1
2485,Millennials trust the postal service more than Amazon. (via @CNBCMakeIt) ,Amazon,1
2487,"Can't wait for Sunday? From Amazon Alexa to Walmart, watch the Super Bowl commercials that have already been released. ",Amazon,1
2488,UPS is taking on Amazon with its own fleet of electric vans ,Amazon,1
2490,Amazon and Deliveroo argue that UK competition probe is 'speculative' ,Amazon,1
2491,This map shows how Amazon's warehouses are rapidly expanding across the country. ,Amazon,1
2492,MacKenzie Bezos sells $400 million of her Amazon shares.,Amazon,1
2495,"AutoZone sells almost anything you would need to fix, maintain or improve your car. Its staff is trained to help answer highly specific questions about auto maintenance — that’s something e-commerce giants like Amazon just can’t compete with. ",Amazon,1
2497,"With package theft at an all-time high, Amazon and others are fighting back. ",Amazon,1
2498,Amazon will break ground on HQ2 soon — here's what it will look like.,Amazon,1
2500,"“There’s no guarantee that Amazon can be a successful company. What we’re trying to do is very complicated,” Jeff Bezos said in 1999. “Scale is important to us and we’re going to go after that kind of scale.”",Amazon,1
2501,"In this #CNBCClassic clip, anchor Tyler Mathisen covers Netflix's 2002 IPO. CEO Reid Hastings expressed optimism, citing the strong stock performance of Amazon and Blockbuster as proof of growing consumer spending.",Amazon,1
2502,"Every year, Amazon and other retailers end up with billions of pounds of excess inventory that goes to landfills. Now, these companies are using AI to do something about all of this waste. Watch the full video here: ",Amazon,1
2503,Returns can be a major headache and create billions of pounds of waste. Here’s how Amazon is redefining the return process. ,Amazon,1
2504,Amazon is reportedly working to allow customers to connect their credit card information to their hands. ,Amazon,1
2505,Amazon CEO Jeff Bezos shares the career advice he gives his kids. (via @CNBCMakeIt),Amazon,1
2507,Trump administration cracks down on counterfeits sold on Amazon and other online retailers ,Amazon,1
2508,Here’s how auto parts retailer AutoZone is thriving in the era of Amazon. ,Amazon,1
2509,AutoZone's stock surged 40% in the last year. Here's how it's thriving in the era of Amazon,Amazon,1
2510,It turns out Amazon Prime may not be as convenient as everyone thinks. Here's why: ,Amazon,1
2513,"Mnuchin warns UK over plan to tax the likes of Facebook, Amazon and Google ",Amazon,1
2515,Amazon just filed a bunch of international trademarks for 'Amazon Pharmacy' ,Amazon,1
2516,Jeff Bezos says this is what he would have done if Amazon didn't work out. (via @CNBCMakeIt),Amazon,1
2517,Here's how much you can save at Whole Foods if you're an Amazon Prime member. ,Amazon,0
2519,Amazon reportedly wants to turn your hand into a credit card ,Amazon,1
2520,"For $285,000, you can buy a hospital room on Amazon.",Amazon,0
2521,"Tennessee governor to sign anti-LGBTQ adoption bill despite Amazon, Nike opposition ",Amazon,1
2522,PopSockets CEO says Amazon uses 'bullying with a smile' to press for lower prices ,Amazon,1
2523,Wall Street sees Amazon rejoining the trillion-dollar club later this year ,Amazon,1
2525,"This week, Amazon CEO Jeff Bezos announced a $1 billion investment into Indian businesses, as local business owners protested his visit.",Amazon,1
2527,Amazon reportedly wanted to secure $1 billion in incentives on top of HQ2 deal,Amazon,1
2528,Peter Navarro puts Amazon and eBay on notice: The China trade deal cracks down on counterfeits ,Amazon,1
2529,"Here are Thursday's biggest analyst calls of the day: Nvidia, Tesla, Amazon &amp; more ",Amazon,1
2552,Amazon fires employees for leaking customer email addresses and phone numbers ,Amazon,1
2559,"More brands are leaving Amazon, but the strategy could backfire ",Amazon,1
2562,Kohl's tie-up with Amazon was seen as a game changer. But sluggish holiday sales suggest it isn't ,Amazon,1
2564,Amazon's latest health hire is a high-profile public health expert and 'lung doc' ,Amazon,1
2568,"Amazon bans sponsored products related to political campaigns, but you can still find them on the site. ",Amazon,1
2569,Amazon struggles to enforce its own rules for political ads ,Amazon,1
2571,Amazon partners with Future Retail to further its push into the Indian market ,Amazon,1
2572,Bernie Sanders taps Amazon employees to blast the company's record on climate change ,Amazon,1
2573,"Amazon partners with Lamborghini, Rivian to offer Alexa voice assistant in vehicles ",Amazon,1
2574,Here's why your Amazon Prime membership may not be worth the price. ,Amazon,1
2576,Here's how — and why — Amazon Web Services uses trucks and military-grade hard drives to transfer massive amounts of data to the cloud. ,Amazon,1
2577,Amazon has a solution for employees who no longer want to work there — pay them to quit. ,Amazon,1
2579,Your Amazon package could soon be delivered by drones. Watch the full video here: ,Amazon,0
2580,Amazon threatens to fire employees who speak out on climate change ,Amazon,1
2581,Tied up Washington woman uses Amazon Alexa device to call police after boyfriend allegedly attacks her with baseball bat ,Amazon,0
2584,New Jersey family says they unexpectedly received soiled diapers after placing Amazon order ,Amazon,1
2589,Meet Brazil's young indigenous climate activist on a mission to save the Amazon where her village resides. ,Amazon,0
2590,Amazon founder Jeff Bezos' phone was allegedly hacked after receiving a file sent from Saudi Arabia's MBS' WhatsApp account ,Amazon,1
2591,Brazil to create 'Amazon Council' to protect and develop forest ,Amazon,0
2592,"Amazon forest fires increased by 84% in 2019 compared with 2018, says report— in pictures",Amazon,0
2593,Amazon surge as sales beat targets and Prime membership reaches 150 million,Amazon,1
2594,Amazon and Deliveroo tell the CMA that its inquiry into their proposed tie-up is based on flawed assumptions ,Amazon,1
2595,"Amazon and Deliveroo dismiss ""speculative"" CMA probe ",Amazon,1
2598,"More than 350 employees publicly criticised Amazon’s climate change record, calling for the company to drop cloud-computing contracts with oil and gas industry clients",Amazon,1
2599,Patrick Stewart's still got it – but new Amazon Prime series Star Trek: Picard takes a while to get off-planet ,Amazon,0
2600,★★★ for the new Star Trek: Picard on Amazon Prime ,Amazon,0
2605,"Opinion: India needs to show more grace towards existing investors. The lambasting of Amazon, one of the country’s biggest foreign direct investors — amid a severe economic slowdown — left many in the business community in shock ",Amazon,1
2609,Does Amazon's Alexa have a political bias in terms of the news stories she offers us? ,Amazon,1
2610,Reliance takes on Amazon and Walmart in India with JioMart ,Amazon,1
2611,"Opinion: Forgoing online shopping on sites like Amazon and Ocado in favour of the local high street can make a real difference in terms of plastic consumption, fuel expenditure and the purchase of excess food that is never eaten ",Amazon,1
2612,Amazon profits surge as investment in faster shipping pays off ,Amazon,1
2613,"Trust our expertise or face catastrophe, Amazon peoples warn on environment ",Amazon,1
2614,Hundreds of workers defy Amazon rules to protest company's climate failures ,Amazon,1
2616,Cacao not gold: ‘chocolate trees’ offer future to Amazon tribes ,Amazon,0
2623,Amazon plans $1bn investment in India despite trader backlash,Amazon,1
2625,Alerting Amazon about its unsafe lamp cost me £221,Amazon,1
2626,We’ve found a deal on an iPad at Amazon that would make the perfect present for Valentine’s Day. ,Amazon,1
2628,"Congress says PM ""not interested in constitution"", Amazon notice attached. ",Amazon,1
2629,"#BanegaSwasthIndia | From Carbon to green footprints, Amazon India will soon be rolling out 10,000 electric delivery vehicles across 20 cities, as part of Amazon’s Climate Pledge.",Amazon,1
2630,Saudi involved in hacking of Amazon Boss Bezos' phone: report. ,Amazon,1
2631,Amazon founder Jeff Bezos visits Taj Mahal with girlfriend Lauren Sanchez. ,Amazon,1
2632,Jeff Bezos rolls out another Amazon gift for India: delivery e-rickshaws. ,Amazon,1
2633,"After Centre's Jeff Bezos Snub, An Amazon Offer, A Retreat: 10 Points",Amazon,1
2634,"After snub to Amazon, BJP slams Bezos-owned Washington Post. ",Amazon,1
2635,"""Fall in love with India every time I return here"": #JeffBezos, Amazon founder and CEO. He said on Wednesday that his company will invest $1 billion to bring small and medium-sized businesses online in India. More on",Amazon,1
2636,"""No favour, Amazon covering losses"": Union Minister Piyush Goyal on $1 billion investment",Amazon,1
2637,"""Unending love for Amazon"": RSS-linked trade body attacks NITI Chief. ",Amazon,1
2643,Amazon forest fires increased by 30% in 2019: Report,Amazon,0
2644,Brazil establishes #Amazon Council to protect rainforest ,Amazon,0
2645,Some cybersecurity experts say a report that Jeff Bezos commissioned doesn't show with certainty that his cellphone was hacked. The Amazon founder and Washington Post owner says he was hacked after he received a video file from Saudi Arabia’s crown prince. ,Amazon,1
2646,"The Latest: ""Fleabag"" wins its second Golden Globe of the night, this time for best TV comedy series. The Amazon show follows a misanthropic single woman in her relationships with men and family in London. ",Amazon,0
2647,Amazon employees plan mass defiance of company communications policy in support of colleagues ,Amazon,1
2648,Amazon seeks to force Pentagon to halt work on JEDI cloud computing contract ,Amazon,1
2652,Amazon threatens to fire critics who are outspoken on its environmental policies ,Amazon,1
2653,Amazons were long considered a myth. These discoveries show warrior women were real. ,Amazon,0
2654,Amazon expands food stamp benefits for online groceries to Washington state. ,Amazon,1
2655,"Hundreds of Amazon employees are taking a stand against what they say is the e-commerce giant's ""insufficient action on the climate crisis""—in spite of claims that their jobs were threatened for speaking out in the past about the issue. ",Amazon,1
2656,"U.N. officials say they have information suggesting Saudi Arabia may have attempted to hack Amazon CEO Jeff Bezos' phone in an effort to ""influence, if not silence"" the Washington Post's reporting on the kingdom. ",Amazon,1
2658,A woman claims she got a very unpleasant -- and potentially hazardous -- Amazon delivery this week when she ordered two boxes of diapers. ,Amazon,1
2660,The richest man in Asia soon may become even wealthier: The energy industry tycoon is reportedly launching a new e-commerce service in India to compete with Amazon. ,Amazon,1
2664,"Investors focus on Amazon's push to speed up deliveries, which has driven up costs but is fueling growth, according to the online retail giant ",Amazon,1
2665,Amazon posts higher profit and revenue as it benefits from strong holiday sales and stabilizing shipping costs. Shares rose about 13% after hours.,Amazon,1
2666,Amazon is expanding its warehouse operations in New York City as the online retail giant pushes to speed delivery to customers in the area ,Amazon,1
2667,Seattle's latest musical sensation is not what you'd expect. It's the Amazon Symphony Orchestra. The first chair flutist is a technical recruiter; a software engineer is on the viola. ,Amazon,0
2668,"One of the world’s richest men, Jeff Bezos, and one of the most powerful princes, Mohammed bin Salman, have become archenemies, each accusing the other of betrayal after working cordially to try to establish an Amazon presence in Saudi Arabia ",Amazon,1
2669,"Federal prosecutors in Manhattan have evidence indicating Amazon CEO Jeff Bezos’ girlfriend provided text messages to her brother that he then sold to the National Enquirer for its article about Bezos’ affair, according to people familiar with the matter ",Amazon,1
2671,"From @WSJopinion: Amazon’s Jeff Bezos gets the cold shoulder from India’s leaders. And he's not the only foreign executive to feel the chill, writes @dhume",Amazon,1
2672,"Now showing on Amazon Prime Video: conspiracy theories, homemade how-to videos and other amateur productions ",Amazon,0
2676,Amazon is working on checkout terminals that would let consumers pay with their hand ,Amazon,1
2677,The $1 billion goal set by Jeff Bezos and his top lieutenants was separate from any economic incentives Amazon might win for its second-headquarters project,Amazon,1
2684,Crowdfunding firms sought to transform real estate investing the way Amazon changed retail. It hasn’t worked out that way. ,Amazon,1
2687,"New York state officials offered Amazon almost a billion dollars more of incentives than was previously known to win its second-headquarters contest and were even prepared to pay part of some employees’ salaries, records show ",Amazon,1
2690,Amazon conquered the cloud early. Now it has to defend what it built. ,Amazon,1
2692,"Amazon holiday sales jump as one-day shipping quadruples, stock up 13%",Amazon,1
2693,UPS doubling down on weekend deliveries as e-commerce booms and Amazon looms ,Amazon,1
2695,"EBay forecast disappoints amid competition from Amazon, Walmart ",Amazon,1
2699,Jumia was the first African tech firm to list in New York last year. But it was a bruising 2019 for 'Africa's Amazon'. Co-founder @JHodara says the focus is on proving it can turn a profit,Amazon,1
2705,Brazilian tribes back manifesto to save Amazon habitat from Bolsonaro ,Amazon,0
2708,Brazil's answer to Greta Thunberg wants help protecting Amazon rainforest and its tribes ,Amazon,0
2710,"Amazon CEO Jeff Bezos announced a $1 billion investment in India, saying it would bring small businesses online in the country, but the action failed to impress the country's trade minister",Amazon,1
2711,India's trade minister remains unimpressed with Amazon's $1 billion investment as CEO Jeff Bezos continues his visit to the country,Amazon,1
2712,"'It’s not as if they are doing a great favor to India when they invest a billion dollars,' trade minister snubs Amazon as its CEO Jeff Bezos visits the country ",Amazon,1
2715,"Indian Prime Minister Narendra Modi’s ruling party slammed the editorial policies of billionaire Jeff Bezos-owned Washington Post, even as his e-commerce firm Amazon announced plans to create a million jobs in the country ",Amazon,1
2718,Amazon promises 1 million new jobs in India amid tensions with government,Amazon,1
2723,Amazon's $1 billion investment in India no big favor: minister,Amazon,1
2748,"U.S. drugstore operator Walgreens Boots Alliance disappointed Wall Street with its Q1 earnings, as it was hit by lower payments from insurers and an intense competition from the new arrival in the pharmacy market - Amazon",Amazon,1
2749,It was a poor Q1 for drugstore operator Walgreens Boots Alliance as it faced lower payments from pharmacies and intense competition from the arrival of Amazon in the pharmacy market,Amazon,1
2754,Amazon Fire TV crosses 40 million active users globally,Amazon,0
2755,"Alphabet, Amazon keep S&amp;P afloat as Middle East tensions persist ",Amazon,1
2759,"Amazon is generating lots of free-cash flow, time to get on board: Barron's ",Amazon,1
2761,Amazon considers opening stores in Germany: report ,Amazon,1
2762,Did Saudi Arabia’s crown prince hack the Amazon king? ,Amazon,0
2765,"If you are writing a book about Amazon, you should form a view on its management style ",Amazon,1
2766,"Some of Amazon’s practices look rather Victorian, whether or not they are standard for the industry ",Amazon,1
2768,Foreign critics focus less on the fate of Brazil's democracy than on that of the Amazon rainforest ,Amazon,0
2769,"On Jair Bolsonaro's watch, deforestation of the Amazon rose by 80%",Amazon,0
2771,"Climate activist @GretaThunberg calls on world leaders to stop ""cheating and fiddling around with numbers"" to meet climate targets, adding it is not enough to ""plant trees in Africa, while... the Amazon is slaughtered at an infinitely higher rate"" ",Amazon,0
2772,Amazon 'threatens to fire' climate change activists ,Amazon,1
2774,"Officials from the Department of Homeland Security and the White House said they are taking steps to shift more of the burden of tackling counterfeit goods to e-commerce hubs like Amazon, a response to an April 2019 presidential memo",Amazon,1
2778,"If hackers could get into Amazon CEO Jeff Bezos's iPhone, can they get into yours? Here's what you need to know to stay safe: ",Amazon,1
2779,FedEx said it will start delivering packages through its new Sunday ground service this weekend as it competes with Amazon and other courier services ,Amazon,1
2780,RECALL ALERT: Baby Trend has recalled four models of their strollers sold at Target and Amazon. Anyone who has the stroller should immediately stop using it. ,Amazon,0
2781,The Amazon is a key buffer against climate change. A new study warns that wildfires could imperil it to the point that the forest could actually begin contributing more planet-warming gases to the air than it absorbs by 2050 — or sooner.,Amazon,0
2783,Amazon is capping off a big week in India with an eye-catching pledge to help create a million new jobs in the country. The company says it expects the jobs to be added over the next five years through ongoing investments in its operations on the ground. ,Amazon,1
2788,"As delivery from Amazon has redefined what convenience means for many Americans, the 24-hour, 3,230-average-square-foot convenience store still fills a niche for time-strapped customers searching for a bite to eat and a fill up at the pump",Amazon,1
2791,Amazon is enlisting one of India's biggest retailers to bulk up its offline business and fend off a challenge from the country's richest man in the online space ,Amazon,1
2792,"For the first time, researchers have uncovered the remains of four Amazons with different ages in the same tomb, according to a release by Russia's RAS Institute of Archeology. ",Amazon,0
2795,Everyone from Amazon to Silicon Valley startups are trying to eliminate lines in retail stores. Some tech companies are bringing the AI directly to your shopping cart. ,Amazon,1
2797,"Amazon's ""Fleabag"" won best TV series, musical or comedy at the #GoldenGlobes. Creator Phoebe Waller-Bridge accepted the award, giving a ""huge huge thank you for everyone supporting us so much.""",Amazon,0
2798,"The recent fires that have ravaged North America's west coast, Europe, the Amazon, and the Arctic Circle should have been enough, together with all of the other mounting evidence, to bring politicians to their senses, writes Paul Hockenos for @CNNOpinion",Amazon,0
2800,Some U.S. pharmacies report being entirely sold out of masks and some popular sellers on Amazon say deliveries will be delayed for weeks ,Amazon,1
