,text,search_term,label0
7815,French supermarket retailer Carrefour and Uber Eats are teaming up to launch a new delivery service to help Parisians buy essential goods and food during the nationwide lockdown ,UBER,1
7816,France's Carrefour teams up with Uber Eats for lockdown deliveries ,UBER,1
7817,"Uber is discussing layoffs of as much as 20% of its work force, or roughly 5,400 employees, as its business has suffered in the coronavirus pandemic",UBER,1
7818,Uber and Lyft face an existential question: How will they and their drivers stay afloat when most people are staying home? ,UBER,1
7821,Cash-strapped Royal Caribbean drains its revolving credit lines due to coronavirus pandemic ,Royal Caribbean,1
7822,"Stocks making the biggest moves after hours: PVH, Royal Caribbean, AMC &amp; more ",Royal Caribbean,1
7827,"Here's how Tesla stock swings 18% higher, trader says $TSLA (via @TradingNation)",TSLA,1
7830,"Tesla ventilators won't arrive in time for coronavirus apex, Cuomo says ",Tesla,1
7831,Tesla delays Semi production and deliveries until 2021,Tesla,1
7832,Tesla rises as company ekes out a Q1 profit.,Tesla,1
7833,Tesla stock ticks up as company ekes out profit. ,Tesla,1
7834,Tesla reports Q1 earnings after the bell,Tesla,1
7835,"For subscribers: Tesla is poised to beat earnings and possibly qualify for S&amp;P 500 inclusion, Barclays says",Tesla,1
7836,Tesla board members must now rely on Elon Musk to pay legal expenses ,Tesla,1
7837,"Tesla revealed in a new SEC filing some of the ways that it works with SpaceX, included the purchase of $600,000 of Tesla car parts by SpaceX in Q1 of 2020.",Tesla,1
7838,"China's battered Tesla rival Nio brushes off coronavirus impact, says the worst is over ",Tesla,1
7843,Tesla asks dozens of employees to resume production at Fremont car plant before coronavirus health orders end ,Tesla,1
7845,"Investors pick Tesla over GM, Toyota to lead emerging auto tech post-coronavirus crisis ",Tesla,1
7851,"New for subscribers: Tesla shares jump after hours as Goldman initiates with buy rating, sees rally above $800",Tesla,1
7852,Missouri city offers $1 billion in incentives for Tesla Cybertruck factory,Tesla,1
7855,"New for subscribers: Tesla shares pop after Credit Suisse upgrades stock, says company will increase electric car lead ",Tesla,1
7858,Tesla engineers are building ventilators for coronavirus patients out of car parts—take a look. (via @CNBCMakeIt),Tesla,1
7859,Tesla furloughs hit half of U.S. sales and delivery employees ,Tesla,1
7860,"Coronavirus pushes auto dealers to embrace online sales like Tesla, Carvana ",Tesla,1
7863,"Tesla will slash employee pay, and will furlough hourly workers until May 4",Tesla,1
7865,"Tesla just revealed its prototype ventilator, made from adapted parts from electric vehicles. Take a look. ",Tesla,1
7866,New for subscribers: Analysts continue to upgrade stocks like Tesla and eBay on hopes the rebound is for real ,Tesla,1
7868,"New for subscribers: Jefferies upgrades Tesla, predicts nearly 30% comeback and return to energy efficiency post crisis",Tesla,1
7869,"Tesla is dismissing contractors at its California and Nevada factories, sources say ",Tesla,1
7870,"Tesla reported better-than-expected delivery numbers — delivering approx. 88,400 vehicles in Q1, vs. analysts’ 79,900 estimate.",Tesla,1
7873,"Tesla up more than 17% after hours after company reports Q1 deliveries of 88,400.",Tesla,1
7875,"Tesla soars on delivery numbers — company delivered 88,400 vehicles in Q1",Tesla,1
7876,"Tesla delivers 88,400 vehicles in Q1",Tesla,1
7878,"Tesla could help make batteries for ventilators to help fight COVID-19, says ResMed CEO",Tesla,1
7879,"Elon Musk says the Tesla Cybertruck will be able to float ""for a while"" ",Tesla,1
7880,"Elon Musk publishes list of hospitals Tesla sent ""ventilators"" to after claims none were delivered to California ",Tesla,1
7881,Tesla reportedly seeks rent reductions after coronavirus-linked staff pay cuts and furloughs ,Tesla,1
7883,"Staff at @Tesla explain how they are making ventilators with car parts to help patients being treated for #coronavirus. For the latest updates on #COVID19, click here:",Tesla,1
7885,Tesla ekes out profit despite virus disruptions ,Tesla,1
7887,Tesla beats revenue expectations despite coronavirus disruptions ,Tesla,1
7888,"""Dear Elon..."": Ukraine asks Tesla chief for ventilators to fight virus ",Tesla,1
7891,Don't blink! Take a glance at the production line of #Tesla's Shanghai gigafactory. The plant resumed operation two months ago @elonmusk,Tesla,1
7892,Tesla posts slight profit as the coronavirus puts a damper on expectations ,Tesla,1
7893,"The return of erratic Elon Musk: During coronavirus, Tesla CEO spreads misinformation and over-promises on ventilators ",Tesla,1
7895,"Tesla posted a surprise first-quarter profit, propelled by strong demand for its Model 3. Shares gained 7% after hours.",Tesla,1
7896,Tesla CEO Elon Musk's ability to navigate the pandemic faces a test this week ,Tesla,1
7897,Tesla told its landlords it would like to discuss options “so we can continue to partner and work together to ensure a continued and mutually beneficial relationship” ,Tesla,1
7900,Tesla said first-quarter deliveries of its electric vehicles rose 40% compared with a year ago while not addressing how the coronavirus pandemic might hurt future sales,Tesla,1
7901,Tesla's profit streak not derailed by coronavirus as auto industry braces for losses ,Tesla,1
7903,Corona what? Tesla retail investors appear unfazed by virus impact ,Tesla,1
7907,Tesla is calling some workers back to California factory: Bloomberg News ,Tesla,1
7909,Tesla's China-made Model 3 prices rise after EV subsidies cut,Tesla,1
7910,"On @Breakingviews - Tesla gets board street cred it sorely needs, writes @AntonyMCurrie: ",Tesla,1
7911,Tesla raises China-made #Model3 prices after authorities cut subsidies on electric vehicles in the world’s biggest auto market,Tesla,1
7922,Tesla surges 28% in two days as traders look beyond coronavirus disruption,Tesla,1
7924,"U.S. electric vehicle maker Tesla expands locally made line-up, blunting trade war impact ",Tesla,1
7925,Tesla starts selling two new locally made Model 3 variants in China,Tesla,1
7926,"Tesla is cutting salaries and furloughing non-essential workers, saying the decisions were part of a broader effort to manage costs and achieve long-term plans ",Tesla,1
7927,Tesla told employees it will furlough all non-essential workers and start implementing salary cuts during a shut down of its U.S. production facilities ,Tesla,1
7928,Tesla became the latest U.S. car maker to announce job cuts and said it’s cutting salaries for all employees and furloughing non-essential workers ,Tesla,1
7935,Tesla engineers show ventilator prototype on YouTube ,Tesla,1
7938,"Tesla cuts contractors from California, Nevada factories: CNBC ",Tesla,1
7939,Tesla misses estimates for quarterly deliveries ,Tesla,1
7940,'Dear Elon': Ukraine takes up Tesla's ventilator offer via Twitter ,Tesla,1
7942,Tesla plans to supply FDA-approved ventilators free of cost: Musk ,Tesla,1
7943,Tesla stands out in commanding investor's confidence. Its shares are up by 64% this year,Tesla,1
7944,The pandemic will not hurt every everyone equally. Tesla in particular has had a good crisis ,Tesla,1
7946,This was supposed to be the year that profit became the norm at Tesla. Then came the coronavirus crisis. ,Tesla,1
7951,"Tesla built more than 100,000 vehicles in the first quarter, despite shutdowns at its plants in Shanghai and Fremont, California, due to health concerns associated with the coronavirus",Tesla,1
7952,"The Tesla Quartet, an acclaimed young ensemble, was making a fragile but sustainable living. Then came the coronavirus. ",Tesla,1
7954,"Tomorrow at 5:00 pm, join us for a FB Live panel w/ @RiseNowUs in honor of #SAAM. Moderated by @lannadelgrey, panel participants @nguyen_amanda, @sebastianlanz and Dr.Ganguly will discuss the challenges #COVID19 presents for survivors.",FB,1
7955,"Facebook’s top brass gathered at Mark Zuckerberg’s 700-acre estate on Kauai to refocus FB. Changes came, but not what everyone expected.",FB,1
7956,"If an advert for an official NHS Coronavirus contact-tracing app appeared in your Facebook news feed, would you install it? ",Facebook,1
7958,Join @thomgibbs tomorrow for the Telegraph's pub quiz on Facebook LIVE at 8.10 pm #YouAreNotAlone,Facebook,0
7959,"This is not a case of “good king, bad advisers” The inside story of how Facebook went from idealism to scandal, by @LFDodds",Facebook,1
7963,"This is a testing time for all of us. So, we've launched the Telegraph Community Facebook group where you can talk gardening, films and more and talk exclusively to our writers and experts. Join us here today #YouAreNotAlone ",Facebook,1
7964,Chinese state media is flooding Facebook and Instagram with undisclosed political adverts whitewashing its role in the coronavirus pandemic and pinning blame on Donald Trump | @LFDodds,Facebook,0
7966,"Dawn Madsen and Frank Gulenchyn were long-time residents of Ontario's Durham region, according to the Regional Municipality of Durham. ""Our hearts go out to their family and all families affected by this senseless tragedy,"" said the release. 14/ (Jon Farrington/Facebook)",Facebook,0
7967,"Lillian Hyslop was killed while out for a walk in the Wentworth Valley on Sunday morning, her long-time walking partner and neighbour, Heather Matthews, confirmed. 13/ (Facebook)",Facebook,0
7968,"Family members posted several tributes to Peter and Joy Bond on Facebook, identifying them as victims of the shooting. They are survived by two adult sons. 12/ (Facebook)",Facebook,0
7969,"Heather O'Brien was a licensed practical nurse, a wife, mother and grandmother. The Victorian Order of Nurses confirmed she worked there for nearly 17 years.",Facebook,0
7970,"Kristen Beaton, a continuing-care assistant, was a wife and mother. The Victorian Order of Nurses confirmed she worked there for nearly six years. The organization called her compassionate and caring. 8/ (Facebook)",Facebook,0
7971,The federal privacy commissioner concluded in February that Facebook broke Canada's privacy laws. Facebook wants that finding tossed out. ,Facebook,1
7972,"Tom Bagley of West Wentworth, N.S., is being remembered for always willing to lend a hand to others. 7/ (Charlene Bagley/Facebook)",Facebook,0
7973,"Lisa McCully was a longtime teacher and a mother of two who lived in Portapique, N.S. She taught at Debert Elementary School. ""She was somebody who taught from the heart,"" said Nova Scotia Teachers Union president Paul Wozney. 3/ (Facebook)",Facebook,0
7974,"Facebook, Twitter and Google have taken unprecedented steps to fight misinformation online because of the COVID-19 pandemic.",Facebook,1
7976,A man who lost his wife and daughter in the Flight 752 disaster says he received a stream of hateful messages on Facebook. Family members of other victims also say they have been threatened.,Facebook,1
7977,Jennifer Saunders denies writing Facebook post attacking NHS over PPE shortages ,Facebook,0
7978,Travel expert @SimonCalder is now live on Facebook to answer your questions ,Facebook,0
7988,Facebook stops advertisers from being able to target users interested in 'pseudoscience' ,Facebook,1
7989,Travel expert @SimonCalder is answering your questions live on Facebook now ,Facebook,0
7992,Republican governor condemns senator’s anti-semitic Facebook post along with sign at lockdown protest ,Facebook,1
7997,Facebook bans protest events against social distancing ,Facebook,1
8000,Facebook launches gaming app to take on YouTube and Twitch ,Facebook,1
8001,Facebook refuses to crack down on armed anti-lockdown marches ,Facebook,1
8002,Facebook launching worldwide project to track coronavirus ,Facebook,1
8004,Our travel expert @SimonCalder will be answering all your questions live on Facebook from 12 noon,Facebook,0
8006,Australia forces Google and Facebook to fund traditional news ,Facebook,1
8013,Facebook removes sports therapy video for the elderly over 'sexual activity' violation pic.twitter.com/78DNt6i7R9,Facebook,1
8014,Facebook adds new 'Care' reaction ,Facebook,1
8016,"Our Travel Correspondent, @SimonCalder will be answering all your concerns live on Facebook from 12 noon today Click the link below to get involved",Facebook,0
8030,Our travel expert Simon Calder is answering your questions live on Facebook now: ,Facebook,0
8032,Our Travel Correspondent @SimonCalder will be answering all your concerns live on Facebook from 12 noon this afternoon Make sure you're there,Facebook,0
8035,Facebook adds 'quiet mode' to stop it being so stressful ,Facebook,1
8036,Join our live Travel Q&A with Simon Calder on Facebook now: ,Facebook,0
8040,Nigel Farage did a Facebook Live in eye-wateringly short shorts and we all just want to un-see it ,Facebook,0
8042,Got a question about how coronavirus has changed your travel plans? Ask @SimonCalder live on Facebook from 12 noon,Facebook,0
8044,Facebook to gather information about users' health in attempt to create covid-19 'heatmap',Facebook,1
8045,Man shot dead while streaming hide and seek 'game night' on Facebook Live ,Facebook,0
8047,Facebook says it is taking 'aggressive steps' in response to 5G coronavirus conspiracy theory,Facebook,1
8048,Facebook Messenger app launched on Mac and Windows as users rush to group video chats ,Facebook,1
8049,"Facebook is like Galactus, but instead of eating planets it's eating your data. And now it seems they may have a new means to do so. ",Facebook,1
8050,"Facebook removed the 'pseudoscience' category from its advertising pages, but is it too little too late for a platform that seemingly hopes to become the next Ministry of Truth? ",Facebook,1
8051,Facebook deems protests ‘harmful misinformation’ as citizens defy quarantine orders ,Facebook,1
8052,Facebook is starting to sound like every comically evil big tech company science-fiction novels have been warning us about for eons. ,Facebook,1
8054,"#Facebook &amp; #Twitter censor posts from Latin American Presidents under the cover of #COVID19, including the leaders of Brazil &amp; Venezuela. Chris Sweeney asks whether the social media giants would dare do the same to the leaders of more powerful nations?",Facebook,1
8055,Facebook and Google to be forced to share advertising revenue with Australian media companies ,Facebook,1
8056,Melbourne 'guy pals' Facebook group shut down after 'revenge porn' and misogynist abuse posted ,Facebook,1
8057,Naturalists flock to Chris Packham's DIY 'Springwatch' on Facebook ,Facebook,1
8058,"Media deal with Facebook and Google more urgent with coronavirus taking jobs, says regulator ",Facebook,1
8059,"In this Covid-19 era, families live-stream funerals on Facebook",Facebook,1
8061,Facebook needs an 'encore' beyond advertising to make Gene Munster believe in the stock ,Facebook,1
8063,"Dow futures jump 100 points after solid tech earnings, Facebook up 10%",Facebook,1
8064,Facebook CFO David Wehner says ad revenue outlook 'really uncertain' amid pandemic ,Facebook,1
8065,"""We have an important role to play for both people who use the platform but as well as for businesses,"" Facebook CFO David Wehner said when asked if the company is using this moment to convince the public that Facebook is an essential tool amid Covid-19.",Facebook,1
8066,"""We're not immune to this crisis,"" Facebook CFO David Wehner said as he noted the company saw a steep decline in ad revenue amid the Covid-19 pandemic.",Facebook,1
8067,"Facebook stock rises after reporting ""stability"" in ad revenue after fall in March. ",Facebook,1
8068,Here's what to expect when Facebook reports earnings after the bell ,Facebook,1
8069,New for subscribers: Here's what every major analyst expects from Facebook's first quarter earnings report ,Facebook,1
8073,"From Facebook to the State Department, here's how the coronavirus outbreak has changed summer internships. (via @CNBCMakeIt)",Facebook,1
8075,"Google, Facebook, Twitter team up to support addiction recovery during pandemic ",Facebook,1
8077,"Facebook is tracking coronavirus symptoms county-by-county, with an opt-in survey designed to help identify hotspots earlier. ",Facebook,1
8078,Facebook's Messenger Rooms will allow users to create group video calls of up to 50 people.,Facebook,1
8080,"Facebook is taking on Zoom and Houseparty with its new video-calling service, Messenger Rooms. ",Facebook,1
8081,Facebook rolling out free video calling for up to 50 people,Facebook,1
8082,Join us Monday at 1 p.m. ET on our Facebook page for a conversation with CNBC's @laurenthomas and President of @JLL's Retail Advisory Services Naveen Jaggi. They’ll discuss the state of the retail industry during the coronavirus pandemic. Send us your questions!,Facebook,0
8084,"Wondering about the impact of oil's historic plunge? Concerned about how long this unprecedented market volatility will last? We'll be live with @BobPisani answering your questions Friday at 12 p.m. ET, on our Facebook page. Send us your questions!",Facebook,0
8086,Virus precautions by Facebook Marketplace in the UK are falling short of its rivals ,Facebook,1
8088,"Join us Thursday at 1 p.m. ET, 10 a.m. PT on the CNBC Facebook page for a conversation with @veevasystems CEO Peter Gassner and Tech Reporters @levynews and @chrissyfarr. They’ll be discussing how software is helping drugmakers in the race to find a cure for Covid-19.",Facebook,0
8091,Facebook and Amazon lead Big Tech lobbying in the first quarter while Google scales down ,Facebook,1
8095,Facebook just released its coronavirus symptom tracking map ,Facebook,1
8098,"""Every day has been so different."" Here's how executives at Facebook, Twitter and more are working from home. (via @CNBCMakeIt)",Facebook,1
8107,"Do we need to sacrifice privacy to resume life as normal? We're live on Facebook with tech reporter @chrissyfarr, and @Bos_CHIP's @mandl, answering key privacy questions surrounding coronavirus and technology.",Facebook,0
8109,"Do we need to sacrifice privacy to resume life as normal? Join us Tuesday at 1 p.m. ET on our Facebook page for a conversation with tech reporter @chrissyfarr, and Boston Children's Hospital's @mandl. They'll answer key privacy questions surrounding coronavirus and technology.",Facebook,0
8111,Facebook spent $23.4 million in 2019 on Mark Zuckerberg's security and private air travel,Facebook,1
8112,We're LIVE discussing telemedicine in the age of coronavirus with @OneMedical Chair and CEO Amir Dan Rubin and @BerthaCoombs on Facebook. ,Facebook,0
8114,Join us tomorrow at 11AM ET on our Facebook page for a conversation with @BerthaCoombs and @OneMedical Chair and CEO Amir Dan Rubin. They'll discuss telemedicine during the coronavirus pandemic and how it can help companies on the road to reopening.,Facebook,0
8115,"We're LIVE with Stocks Editor Bob Pisani talking volatility, markets, coronavirus, and more on Facebook. ",Facebook,0
8116,"With America at home, Facebook, Google make moves to win more of gaming market ",Facebook,1
8118,"Wondering how long this unprecedented market volatility will last? Uncertain about where we go from here? Concerned about the earnings season ahead? We'll be live with @BobPisani answering your questions Thursday at 12 p.m. ET, on our Facebook page. Send us your questions!",Facebook,0
8119,Facebook is developing new tools for researchers to track if social distancing is working ,Facebook,1
8120,"Facebook expects to add 10,000 workers in product and engineering this year, says Sheryl Sandberg",Facebook,1
8121,"Catch Shark Tank’s @kevinolearytv, Facebook’s @sherylsandberg, and @TheProfitCNBC's @MarcusLemonis tonight at 7 p.m. ET in a special report on CNBC. #CNBCPathForward",Facebook,0
8122,Facebook's Sandberg: Learning from mistakes prepared us to deal with the coronavirus ,Facebook,1
8123,"Facebook defends against COVID-19 misinformation criticism and state government ""collusion"" claims",Facebook,1
8125,GOP senator criticizes Facebook for removing some event pages promoting protests against stay-at-home orders ,Facebook,1
8126,Facebook says its new COVID-19 symptom maps could predict disease spread,Facebook,1
8127,"Facebook groups spreading 5G coronavirus conspiracies call for engineer attacks, mast burnings",Facebook,1
8128,Russia accuses U.S. State Department of snubbing Soviet cosmonaut Yuri Gagarin in Facebook post ,Facebook,0
8129,"Economic impact of coronavirus on women is ""devastating"" and exacerbating inequality, says Facebook's Sheryl Sandberg ",Facebook,1
8130,Aung San Suu Kyi turns to Facebook to get coronavirus message out ,Facebook,1
8131,"""Domestic worker of African citizenship (Nigerian) for sale with a new residency and full legal papers,"" was posted on Facebook by a man in Lebanon. ",Facebook,0
8132,Lebanon arrests a man suspected for putting a Nigerian domestic worker up 'for sale' on Facebook ,Facebook,1
8133,"Media outlets in Australia back a gov't decision to make Google & Facebook pay for content, but some warn of unexpected consequences ",Facebook,1
8136,"Racist abuse of Asians continues on social media despite pledges by Facebook, Twitter and TikTok to tackle issue. ",Facebook,1
8137,Facebook has reported a leap in user numbers as many of its key territories entered lockdown conditions to combat the spread of #coronavirus,Facebook,1
8138,Coronavirus: Facebook warns 'increased engagement' during lockdowns may not last ,Facebook,1
8139,Coronavirus: Woman 'named and shamed' by neighbours on Facebook for not joining clap for carers ,Facebook,1
8142,'I need more beer!!' - 93-year-old's Facebook appeal goes viral,Facebook,0
8147,Facebook launches Tuned app to let couples build digital scrapbook ,Facebook,1
8148,"Facebook will ask users whether they have been infected with the #coronavirus as part of a project to generate ""heat maps"" of the outbreak",Facebook,1
8149,Coronavirus: Facebook to produce 'heat maps' of COVID-19 infections,Facebook,1
8150,"Facebook is launching several multi-person video-chat features on its apps in a move to compete with the popular tools from Zoom, Google and Houseparty. The company announced that it was rolling out Messenger Rooms to its Facebook and Messenger apps ",Facebook,1
8151,"Facebook has acquired a $5.7bn stake in Reliance Jio, confirming an FT report last month that the social media company was looking to join forces with the fast-growing but heavily indebted Indian telecoms group",Facebook,1
8152,How Facebook’s Libra went from world changer to just another PayPal ,Facebook,1
8153,"A Facebook-led digital currency was supposed to change the world. Now, however, with the launch of Libra 2.0 it seems that it will not change much beyond Facebook itself — if indeed it happens at all",Facebook,1
8154,"The Trump administration reached a deal with mask-maker 3M, Facebook will allow researchers to analyse users’ location data and world leaders call for $200bn to help poor countries. Follow our live coverage here:",Facebook,1
8155,Should Facebook ban anti-lockdown protests? The thorny questions of civil rights amid coronavirus ,Facebook,1
8158,"Corona comedy: Facebook cabaret, gamer gags and a WhatsApp panel show ",Facebook,1
8159,Fans pay tribute to F Scott Fitzgerald in worldwide Facebook gathering ,Facebook,1
8160,Extremists are promoting anti-government violence on Facebook. The social media giant is doing little about it. ,Facebook,1
8162,Case against Facebook page for circulating fake news in J&amp;K's Udhampur ,Facebook,1
8163,Facebook upgrades video chat service to target Zoom users ,Facebook,1
8164,Mukesh Ambani's twins Akash and Isha held talks with Facebook: report ,Facebook,0
8165,Mukesh Ambani tops Jack Ma as Asia's richest after Facebook deal ,Facebook,0
8166,"Facebook buys 10% stake in Jio to max out on ""power of WhatsApp""",Facebook,1
8167,Why Facebook invested $5.7 billion in Reliance Jio,Facebook,1
8169,Facebook Teams Up With Mukesh Ambani's Jio: Mark Zuckerberg Shares Why ,Facebook,1
8172,"""I'm in custody"": 'Nisha Jindal' with 10,000 Facebook followers turns out a man",Facebook,0
8173,Recovered #COVID19 man arrested for false Facebook post in Nagpur: Police,Facebook,0
8174,Indian parents in UAE attend son's funeral in Kerala through Facebook ,Facebook,0
8175,Facebook to warn users who liked false #COVID19 posts,Facebook,1
8176,Indian in Dubai sacked by firm over alleged hate speech in Facebook post ,Facebook,0
8178,"Facebook sues Indian techie for running deceptive ads, #COVID19 fake news",Facebook,1
8179,"Ensure rogue #COVID19 posts don't go viral: India tells Facebook, TikTok",Facebook,1
8180,"Who cleared Delhi mosque event, asks Sharad Pawar on Facebook live ",Facebook,0
8181,"Facebook announced it would remove anything promoting anti-lockdown protests, the company must determine whether protests violate the states' individual stay-home orders ",Facebook,1
8182,"One human family fighting one common enemy. We select encouraging words from comments on Xinhua's social media pages to design #KindnessPostcard, as we jointly combat #COVID19. Here's the message from Frank Cunningham on Facebook. #FightVirus #SpreadKindness",Facebook,0
8183,#COVID19 cases on aircraft carrier USS Theodore Roosevelt rise to 155: report,Facebook,0
8185,"More than 10,000 people respond to an Israeli woman’s Facebook plea to help overworked health-care workers in the country’s battle against the coronavirus. Volunteers are going grocery shopping, delivering meals, babysitting and even walking pets.",Facebook,1
8186,Facebook earnings rise but uncertainties dominate ,Facebook,1
8187,"Facebook will launch Messenger Rooms, a video conferencing service that allows up to 50 people to chat at once",Facebook,1
8188,Pro-gun activists using Facebook groups to push anti-quarantine protests ,Facebook,1
