,text,search_term,label0
5203,Facebook sued by Australian privacy regulator over Cambridge Analytica scandal ,Facebook,1
5204,Facebook says edited Biden video that endorses Trump is 'partly false information' ,Facebook,1
5206,"In this #CNBCClassic video we had Mark Zuckerberg on-air to discuss the future of the social media business. In 2004, his social networking site had 100,000 users. Today, Facebook has more than 2,000,000,000 users.",Facebook,1
5207,"Facebook, Google giving cash to Silicon Valley communities affected by coronavirus cancellations ",Facebook,1
5208,"Facebook temporarily bans ads, listings for medical face masks amid coronavirus outbreak ",Facebook,1
5209,"Twitter, Google and Facebook to pay hourly workers regular wages despite coronavirus disruptions ",Facebook,1
5210,"Facebook will suffer a coronavirus-related hit to its ads business, Needham analysts say ",Facebook,1
5211,Facebook tells Bay Area employees to stay home and cancel any trips amid coronavirus outbreak ,Facebook,1
5212,Facebook will take down political ads that include coronavirus misinformation ,Facebook,1
5216,Facebook is giving free ads to the WHO and taking down 'conspiracy theories' about coronavirus ,Facebook,1
5222,Missouri man wearing Joker makeup accused of making terrorist threats during Facebook Live video ,Facebook,0
5225,"""It started out as a bit of a joke on Facebook."" Runner, Gareth Allen tells #KayBurley why he ran the distance of a marathon in his garden. Get the latest on #COVID19:",Facebook,0
5226,The government has not run a single advert about the #coronavirus pandemic from its official Facebook or Instagram accounts ,Facebook,0
5228,"UK announces 2% digital services tax on Facebook, Google and Amazon",Facebook,1
5233,Coronavirus: Facebook closes London offices after employee diagnosed ,Facebook,1
5234,Facebook has confirmed that one of its workers in Seattle has been diagnosed with #COVID19,Facebook,1
5235,Facebook closes offices after worker diagnosed with coronavirus ,Facebook,1
5237,"Facebook executives allegedly 'knew for years' that a key advertising metric was exaggerating how many users saw commercials on its site, but failed to disclose or fix the problem, according to a lawsuit against the company ",Facebook,1
5238,"Facebook has announced that it will pay its full-time staff bonuses of $1,000 to support them with cash during the coronavirus pandemic. Follow our live blog for updates and analysis:",Facebook,1
5239,"Facebook has appointed Tracey Travis, the chief financial officer of Estée Lauder, and longstanding McKinsey executive Nancy Killefer to its board of directors, which is now made up of 40% women",Facebook,1
5240,Facebook has so far paid more than $5bn in fines related to the misuse of users’ data in the Cambridge Analytica scandal,Facebook,1
5241,Facebook has ordered staff in Seattle to work from home after confirming that one of its contractors has been diagnosed with coronavirus. Follow our live coverage here: ,Facebook,1
5242,Mark Zuckerberg said Facebook would take measures to remove misinformation about coronavirus from the platform and block ads that ‘exploit the situation’ to help counter the outbreak. Follow our live coverage here: ,Facebook,1
5244,Bubble review – Facebook furore is perfect fit for lockdown era ,Facebook,1
5246,Facebook is still far too powerful. It's also how millions are coping with this crisis | John Harris ,Facebook,1
5247,Facebook says spam filter mayhem not related to coronavirus ,Facebook,1
5248,Zambia: boy arrested for allegedly defaming president on Facebook ,Facebook,0
5251,"Amazon, Microsoft and Facebook advise employees to work from home ",Facebook,1
5253,Coronavirus live updates: new cases confirmed in Scotland as Facebook says it will take down hoax claims ,Facebook,1
5254,Mona Helgeland went on Facebook groups and asked people to send greeting cards to her two self-quarantined kids. ,Facebook,0
5255,Facebook says a Trump ad falsely claiming to be the “Official 2020 Congressional District Census” violates its rules.,Facebook,1
5256,Facebook to give $100 million to news organisations hit by #COVID19 crisis,Facebook,1
5257,"#CoronavirusSolutions | ""Social stigma against doctors and their families is shameful. How can we be so inhuman?"": Union Health Minister Harsh Vardhan Live stream on Facebook: ",Facebook,0
5258,"#CoronavirusSolutions | Medical Microbiologist, Dr Daniela Cirillo to NDTV. #COVID19Outbreak #CoronavirusOutbreak Live stream on Facebook:",Facebook,0
5259,"#CoronavirusSolutions | ""Lockdown is a huge step. It will reduce mortality in India as compared to Italy and other countries"": Dr Arvind Kumar, Founder, Lung Care Foundation Live stream on Facebook: ",Facebook,0
5260,"#CoronavirusSolutions | ""The virus can exist on metal surfaces... best to stay home"": Dr Rajveer Purohit, Associate Professor, Mount Sinai Hospital Live stream on Facebook: ",Facebook,0
5261,#CoronavirusSolutions | Union Health Minister Dr Harsh Vardhan to NDTV on #COVID19Outbreak. Live stream on Facebook:,Facebook,0
5262,"#CoronavirusSolutions | ""Be careful when you use/touch cardboard boxes, droplets can settle on surfaces"": Randeep Guleria, Director, AIIMS Live stream on Facebook: ",Facebook,0
5263,"#CoronavirusSolutions | Dr K Srinath Reddy, Professor, Public Health Foundation of India on #CoronavirusOutbreak. Live stream on Facebook: ",Facebook,0
5264,"#CoronavirusSolutions | ""Need to apply the hammer. Shut down social connections so transmissions go down"": Tomas Pueyo, Author Live stream on Facebook: ",Facebook,0
5266,"#CoronavirusSolutions | ""We should gradually move to testing at home"": Dr Randeep Guleria, Director, AIIMS. #CoronavirusOutbreak #CoronavirusPandemic Live stream on Facebook: ",Facebook,0
5269,"#CoronavirusSolutions | ""We are running short of testing kits"": Dr Navin Dang, Founder and Chairman of Dr Dang's Lab. Live stream on Facebook: ",Facebook,0
5270,"#CoronavirusSolutions | ""Need higher levels of testing"": Kiran Mazumdar Shaw, Chairperson of Biocon. Live stream on Facebook: ",Facebook,0
5271,"#CoronavirusSolutions | ""Don't panic in the first 1-2 days of showing symptoms. Get checked by a doctor in 3-4 days"": Dr Naresh Trehan, Chairman &amp; Managing Director, Medanta. Live stream on Facebook:",Facebook,0
5272,"#CoronavirusSolutions | ""Key finding of this disease is fever, shortness of breath"": Dr Arnold S Monto, Professor of Epidemiology, University of Michigan. Live stream on Facebook: ",Facebook,0
5274,Facebook bug causes legitimate #coronavirus posts to be marked as spam ,Facebook,1
5276,"Twitter tests vanishing tweets to keep up with Snapchat, Facebook. ",Facebook,0
5278,Facebook closes Seattle office after worker infected with #coronavirus ,Facebook,1
5280,Facebook to give WHO free ads in battle with #coronavirus misinformation ,Facebook,1
5282,Plácido Domingo says he is infected with coronavirus. The 79-year-old Spanish tenor says in a Facebook post that he and his family are in self-isolation and that he is feeling well despite having fever and a cough.,Facebook,0
5283,Tens of millions of people are hunkered down to try to curb the spread of the virus. What do to about birthdays? A Norwegian single mother of two went on Facebook groups and asked people to send greeting cards. She was “blown away by the kindness.” ,Facebook,0
5284,"Brazilian president has tested negative for coronavirus, according to a post on his official Facebook profile. ",Facebook,0
5285,Why the coronavirus pandemic is a test Facebook can’t afford to fail ,Facebook,1
5286,"Why the coronavirus could mean more bogus cures, fake government crackdowns and misinformation on Facebook ",Facebook,0
5287,Facebook launches one-stop shop portal for coronavirus information ,Facebook,1
5288,Facebook is blocking legitimate posts about the coronavirus; company executive says it’s a technical glitch ,Facebook,1
5289,"Facebook, Twitter suspend Russia-linked operation targeting African Americans on social media ",Facebook,1
5292,Facebook takes down deceptive Trump campaign ads — after first allowing them ,Facebook,1
5294,Facebook invests additional $100 million in local journalism to support reporting on the pandemic. Emergency grant funding of $25 million will go to local news and another $75 million will be devoted to media marketing.,Facebook,1
5295,LATEST: Facebook CEO Mark Zuckerberg says he and his wife are giving $25 million to accelerate the development of coronavirus treatments.,Facebook,1
5297,"Matt Prestbury, founder of the Black Fathers Facebook group, says he wanted to create a quality space to bring black fathers together where they can talk openly, share stories and give advice. ",Facebook,0
5298,"Facebook, Netflix and Twitter have joined the growing list of companies dropping out of the South by Southwest Festival set to take place in Austin, Texas, later this month amid the novel coronavirus outbreak. ",Facebook,1
5303,"Much disinformation (intentionally misleading) and misinformation (unintentionally misleading) is spread via social media, so how do you spot these fake stories when they appear in your Facebook feed, Twitter timeline or YouTube playlist? ",Facebook,0
5306,"At a moment when there are global scarcities for items as diverse as toilet paper and ventilators, one company offers Facebook and other social-media platforms something else in short supply: fact checking ",Facebook,0
5307,Facebook pledges $100 million in grant money and ad spending to help news outlets weather the financial blow of the coronavirus,Facebook,1
5308,CEO Ian Siegel said in a Facebook comment that he made all the terminations personally over Zoom ,Facebook,0
5311,"One real-estate agent is broadcasting house tours live on Facebook and Instagram, as more industry pros embrace social media to connect with buyers ",Facebook,0
5312,"In a time of limited social interaction, suddenly Facebook’s products seem appealing ",Facebook,1
5313,"Suddenly, after years of distancing ourselves from Facebook, it may just be what we need, writes our columnist @JoannaStern ",Facebook,0
5314,"Bernie Sanders's web-based fans are aggressively using Facebook to support their candidate, and many aren’t ready to embrace Joe Biden ",Facebook,0
5315,"Facebook will give full-time employees an extra $1,000 in their next paycheck and give everyone a good performance review for the first half of 2020",Facebook,1
5319,"Facebook and other tech giants have vowed to fight misinformation related to the coronavirus on their platforms, yet false information persists online ",Facebook,1
5326,Facebook says coronavirus hits advertising sales ,Facebook,1
5327,"Americans are employing humor during coronavirus panic, flocking to new Instagram stars like Quentin Quarantino and sharing Facebook memes about taking off bras and pants and putting on weight, with late-night hosts and comedians getting involved ",Facebook,0
5328,"Netflix, Facebook to cut data traffic in India to ease network congestion ",Facebook,1
5329,Facebook eyes multi billion dollar stake in Reliance Jio: FT ,Facebook,1
5333,"Facebook lowers video quality in Latin America, following Europe ",Facebook,1
5335,Facebook to reduce video streaming quality in Europe ,Facebook,1
5336,"Facebook donates emergency reserve of 720,000 masks due to coronavirus outbreak",Facebook,1
5338,"With concert venues shutting down amid the coronavirus outbreak and bills piling up, American singer Justin Trawick is streaming his performances live on Facebook while also practicing social distancing ",Facebook,0
5339,"Singer-songwriter Justin Trawick, whose livelihood as a stage performer came to a halt due to the coronavirus pandemic, is staying close to his fans by streaming performances live on Facebook ",Facebook,0
5340,Facebook to shift sensitive content moderation to staffers amid coronavirus crisis ,Facebook,1
5346,"Facebook's Libra is scheduled to launch in summer 2020, but the project has run into trouble with regulators says @tomwilson1983 #Reutersfintech",Facebook,1
5348,"Facebook to award $100 mln in cash grants, ad credits to small businesses",Facebook,1
5351,Facebook to send content review contract workers home amid virus concerns ,Facebook,1
5353,"With Italy in a #coronavirus lockdown, the Uffizi art gallery in Florence has taken to Facebook, where it is offering digital tours as an alternative while it is closed. Follow for live updates on coronavirus: ",Facebook,0
5356,Brazil's Bolsonaro tests negative for coronavirus - president's Facebook page ,Facebook,0
5360,Facebook removes 203 accounts for foreign interference from Russia,Facebook,1
5361,Israeli spyware firm NSO seeks court sanctions against Facebook ,Facebook,1
5362,"Australia sues Facebook, alleges breach of user data ",Facebook,1
5365,Facebook closes London offices until Monday due to coronavirus ,Facebook,1
5367,"Facebook, Google ask San Francisco staff to work from home as coronavirus spreads ",Facebook,1
5368,"Facebook, Google ask San Francisco staff to work from home amid coronavirus ",Facebook,1
5371,"U.S. legislation targets online child sexual abuse; threatens encryption on Facebook, Google ",Facebook,0
5376,Facebook to revamp its digital currency plans: The Information ,Facebook,1
5380,The Metropolitan Opera is hosting “Nightly Met Opera Streams” on its website; the Philadelphia Orchestra is broadcasting performances on Facebook Live ,Facebook,0
5381,"Twitter's new policy follows Facebook’s decision in January to remove all deepfakes, except for parodies ",Facebook,1
5386,Facebook boss Mark Zuckerberg says the social network is removing false coronavirus claims and ads for fake cures ,Facebook,1
5389,"World-renowned jazz musician Manu Dibango has died of coronavirus, according to his official Facebook page. ",Facebook,0
5390,"New York Gov. Andrew Cuomo has announced a statewide stay-at-home effort, requiring all non-essential businesses to close. @AthenaCNN is in Times Square, where concerns about coronavirus have driven crowds away from the streets. Watch live on Facebook: ",Facebook,0
5391,Advertisements for face masks continue to appear on Facebook almost two weeks after the company pledged to ban marketing for this medical gear — which hospitals are in dire need of amid the coronavirus pandemic ,Facebook,0
5392,Dr. Sanjay Gupta is here to answer your questions ahead of tonight’s 8 p.m. ET CNN Facebook Global Town Hall – Coronavirus: Facts and Fears. What questions do you have about coronavirus? Watch Live:,Facebook,0
5393,"""This is not normal."" The number of US coronavirus cases keeps rising rapidly. CNN correspondents in Seattle, San Francisco, Chicago and beyond show what life is like in the era of social distancing and sheltering in place. Watch ""Go There"" on Facebook: ",Facebook,0
5394,Facebook must continue to tackle an urgent and potentially dangerous form of misinformation around the coronavirus while it simultaneously tries to figure out how much work its content moderators can do remotely and faces an unprecedented surge in usage ,Facebook,1
5395,"The Trump administration is in discussions with the tech industry, including Facebook and Google, about how to use Americans' cellphone location data to track the spread of the novel coronavirus ",Facebook,1
5396,"As life begins to pick up again in parts of China, lockdowns across the globe due to coronavirus are prompting many to believe the situation will get worse before it gets better. CNN’s reporters give an inside look. Watch ""Go There"" on Facebook at 8:15p ET",Facebook,0
5398,"Brazilian President Jair Bolsonaro, wearing a face mask and speaking on Facebook Live, said he expects the results of his coronavirus test in the coming hours ",Facebook,0
5399,"Facebook, Instagram and Twitter have now taken down all 274 accounts associated with this effort. In total, they were followed by more than a quarter of a million people.",Facebook,1
5400,"Facebook plans to ban medical face mask advertisements and commerce listings from its platform, according to the social media giant's director of product management ",Facebook,1
5401,"Our correspondents in France, Italy, Mexico, the Middle East and China show how authorities are responding to concerns about the spread of coronavirus and what it’s like where they are. Watch ""Go There"" on Facebook: ",Facebook,0
5403,"Ahead of a CNN Town Hall tonight, Dr. Sanjay Gupta answers your questions on the coronavirus and how to protect yourself. Watch it live on Facebook and leave your questions in the comments here: ",Facebook,0
5408,"The spread of coronavirus has prompted educational institutions around the world to postpone or cancel student foreign exchange programs. We hear from college students in Italy, France, Shanghai and Semester at Sea. Watch ""Go There"" on Facebook at 8p ET:",Facebook,0
5412,Facebook announced that it would dole out $25 million in grants to local news outlets. It will also spend $75 million in a marketing drive aimed at news organizations internationally in response to the economic downturn prompted by the coronavirus.,Facebook,1
5414,"In interviews with 2 dozen executives and employees at Facebook, Google and Twitter over the past few months, many described a tense atmosphere of careening from crisis to crisis to handle the newest tactics being used to sow discord and influence votes",Facebook,1
5415,"Facebook is straining to deal with skyrocketing usage during the coronavirus pandemic. “I’ve never seen anything like this before,” Mark Zuckerberg said in an interview. ",Facebook,1
5416,"A mom of 4 uploaded a 90-second rant about online learning to a Facebook group. Not long after, it had been translated into 20 different languages. She told @NYTParenting about her experience.",Facebook,0
5419,"Manu Dibango, a saxophonist from Cameroon whose 1972 hit “Soul Makossa” arrived at the dawn of the disco era on dance floors across the world, died on Tuesday at age 86. A statement on his Facebook page said the cause was Covid-19.",Facebook,0
5420,"Memes spreading on social media are giving bad advice about coronavirus treatment. Here are some of the false claims that are spreading via Twitter, Facebook and WhatsApp. ",Facebook,1
5421,"Twitter, Facebook and YouTube can ""actually deliver on their old promise to democratize information and organize communities, and on their newer promise to drain the toxic information swamp."" @benyt asks: Why did it take a global health crisis to do so?",Facebook,1
5422,"The chief health officer for the California county that includes the headquarters of Facebook and other tech giants has become known for his messaging on the coronavirus. He says there's no spin or political filter: ""Nobody tells me what to say."" ",Facebook,1
5423,A manipulated video featuring Joe Biden and spread by President Trump over the weekend has ratcheted up an online war that has put Twitter and Facebook in the middle of a debate over political speech ,Facebook,1
5424,"Before Clearview — a facial recognition app with a database of billions of photos, scraped from sites such as Facebook, Twitter and LinkedIn — was used by police, it was a secret plaything of the rich ",Facebook,1
5428,Starbucks is temporarily forbidding customers from bringing their own reusable mugs because of fears that they could help spread the coronavirus. ,Starbucks,1
5429,Starbucks bans re-usable cups in UK stores in attempt to prevent coronavirus spread ,Starbucks,1
5431,Starbucks launched #WhatsYourName marketing campaign to 'celebrate the signature act' behind transgender individuals changing their name. Should a coffee company be helping children obtain life altering drugs MORE: ,Starbucks,1
5432,A coronavirus hat and Starbucks physical distancing: the weekend's best photos ,Starbucks,1
5433,Children as young as eight used to pick coffee beans for Starbucks ,Starbucks,0
5436,Starbucks CEO: Our experience tracking coronavirus in China shows US on 'very similar' path ,Starbucks,1
5437,"“This is a time to prioritize people over profit,” Starbucks CEO Kevin Johnson says about the business response to the coronavirus outbreak. ",Starbucks,1
5439,Cramer: Starbucks reopening in China's coronavirus epicenter shows how US might bounce back ,Starbucks,1
5440,'We've got a strong balance sheet': Starbucks CEO defends stock buyback program ,Starbucks,1
5441,"Chick-fil-A, Taco Bell and Starbucks are turning to drive-thrus as COVID-19 spreads",Starbucks,1
5442,"With almost 30,000 cafes around the globe, Starbucks dominates nearly 60% of the cafe market share. But the company's massive expansion hasn't come without growing pains.",Starbucks,1
5443,"Starbucks temporarily adopts 'to go' model, will close or shorten hours near coronavirus clusters ",Starbucks,1
5445,Starbucks CEO says customers may only be able to order via drive-thru or mobile due to coronavirus ,Starbucks,1
5446,Starbucks will offer 'catastrophe pay' to baristas exposed to the coronavirus ,Starbucks,1
5447,"Walmart, Starbucks and others face a new coronavirus challenge: Sick workers and fearful customers ",Starbucks,1
5449,"Starbucks says China business is recovering after coronavirus closures, details hit to sales ",Starbucks,1
5450,Starbucks cancels in-person annual shareholders meeting in Seattle due to coronavirus ,Starbucks,1
5451,"Despite facing controversy and being closed on Sundays, Chick-fil-A is next in line to overtake Starbucks and McDonald’s as the largest restaurant chain. Here’s the story of its rapid ascent in the fast-food game. ",Starbucks,0
5454,Starbucks bans reusable cups over #coronavirus outbreak fears ,Starbucks,1
5461,"Starbucks announced a plan to build a coffee innovation park in eastern China, the largest manufacturing investment by the world's leading coffee chain outside the United States @Starbucks ",Starbucks,1
5462,Starbucks Roastery reboots Shanghai store amid receding epidemic outbreak ,Starbucks,1
5465,Starbucks stores may go drive-thru only or limit seating. ,Starbucks,1
5467,CORONAVIRUS LATEST: ,Starbucks,1
5468,"NEW: Starbucks is offering ""full support"" to its employees during the COVID-19 outbreak, which will include ""catastrophe pay"" and mental health resources.",Starbucks,1
5470,"""We will continue to honor the 10-cent discount for anyone who brings in a personal cup or asks for 'for here' ware,"" Starbucks says.",Starbucks,1
5471,Starbucks says it has reopened the majority of its China stores with enhanced safety protocols ,Starbucks,1
5473,Starbucks will begin to offer 20 free therapy sessions a year for all of its employees,Starbucks,1
5474,"Starbucks is testing a more environmentally friendly coffee cup, and it’s hoping consumers won’t notice ",Starbucks,1
5475,"Starbucks suspended its plans to open more stores in China, as the coronavirus epidemic hit the coffee chain’s results ",Starbucks,1
5476,Starbucks has instructed employees to step up cleaning at its thousands of U.S. restaurants as the coronavirus epidemic gains ground ,Starbucks,1
5477,"Starbucks closes most U.S., Canada cafes, moves to drive-through ",Starbucks,1
5479,"Starbucks halts dine-in service, focuses on 'to go' in U.S., Canada ",Starbucks,1
5480,"Starbucks shifts to 'to go' format in U.S., Canada as virus spreads ",Starbucks,1
5481,Starbucks temporarily moves to 'to go' model amid virus outbreak ,Starbucks,1
5482,Starbucks to invest $130 million for roasting plant in China's Kunshan,Starbucks,1
5483,Starbucks is suspending the practice of filling customers' reusable mugs to prevent the spread of #coronavirus ,Starbucks,1
5484,Starbucks has stopped accepting reusable cups from customers to prevent the spread of #coronavirus ,Starbucks,1
5485,Starbucks stops customers using own cups in bid to contain coronavirus ,Starbucks,1
5488,"Starbucks has closed its cafes in the United States and Canada for two weeks because of the spread of coronavirus, reducing services to drive-thru and delivery only ",Starbucks,1
5489,"Starbucks has started trialing a new recyclable and compostable cup in some locations in New York, San Fancisco, Seattle, London and Vancouver ",Starbucks,1
5491,Starbucks has announced it is temporarily suspending the use of personal cups and tumblers at its stores to help prevent the spread of coronavirus ,Starbucks,1
5492,"In an effort to prevent coronavirus spreading, Starbucks is no longer allowing you to use personal mugs (don't worry, you'll still get your discount) ",Starbucks,1
5494,"A Starbucks employee in downtown Seattle tested positive for the coronavirus, leading to the store's closure for a deep cleaning, the company said ",Starbucks,1
5496,"Starbucks is expecting significantly lower sales in its Chinese stores in the second quarter because of coronavirus. Now, it estimates a 50% decline, and a hit of between $400 million to $430 million to its revenue in China vs. earlier expectations.",Starbucks,1
5502,Starbucks will close all its cafes in the U.S. but remain open for delivery and drive-through customers ,Starbucks,1
5503,Starbucks says it's removing seating in its locations in the U.S. and Canada to promote social distancing ,Starbucks,1
5505,"A Starbucks in Seattle closed after an employee tested positive for the coronavirus, leading many Washington state residents to face the reality that even a small daily ritual like a morning cup of coffee will be affected by the virus ",Starbucks,1
5506,"A union has accused HMSHost, a travel food service company that has long operated Starbucks and other coffee shops in airports across the U.S., of discriminating against immigrant, transgender and black baristas ",Starbucks,1
5507,"Stocks making the biggest moves after hours: RH, Domino's Pizza, Marathon Oil &amp; more ",Marathon Oil,1
5508,"Stocks making the biggest moves after hours: Stitch Fix, Vail Resorts, Marathon Oil and more ",Marathon Oil,1
5510,"No need to fear #coronavirus, practice yoga: Baba Ramdev ",BABA,0
