,text,search_term,label0
2,"The Dow just hit 29,000. $AAPL, $GS, $UNH, $NKE, $MSFT and $MCD have been the best performing components since the Dow hit 28,000 in November.",MSFT,1
3,"Microsoft beat on revenue expectations, driven by strength in its cloud computing platform Azure. The company's intelligent cloud segment revenue, which include Azure, rose 27% to nearly $12 billion",MSFT,1
4,"Tesla and Microsoft topped Wall Street earnings expectations, while Facebook reported rising costs and expenses ",MSFT,1
6,Microsoft pledges to completely remove carbon footprint amid criticism over work with oil g$1iants,Microsoft,1
11,Microsoft ex-employee says contractors in China reviewed audio recordings from Skype calls with ZERO SECURITY ,Microsoft,1
13,"Stocks making the biggest moves midday: Tesla, Penn National Gaming, Facebook, Microsoft &amp; more ",Microsoft,1
14,"Take a look inside Microsoft's flagship London store — fit with an Xbox gaming room, the latest HoloLens headset and even a McLaren sports car. (via @CNBCi)",Microsoft,1
16,"Here's why Microsoft, Google and Apple want you to ditch your password. ",Microsoft,1
17,"Microsoft says it aims to remove more carbon from the atmosphere than it emits by 2030. By 2050, it hopes to have taken out enough to account for all the direct emissions the company has ever made.",Microsoft,1
18,"Microsoft's Super Bowl ad thanks Katie Sowers, the first woman to coach in the big game ",Microsoft,1
19,"Salesforce, which once tried to buy LinkedIn, hires an exec from the Microsoft-owned company ",Microsoft,1
20,"Have trouble keeping track of all of your username and password combos? Watch the full video here to see why companies like Google, Apple and Microsoft want you to ditch your passwords, for good: ",Microsoft,1
21,"Microsoft’s Xbox is one of the world’s most popular gaming consoles. So, why hasn’t it seen success in Japan? Watch the full video here: ",Microsoft,1
22,Microsoft health's Peter Lee says medical industry needs to help patients access to their data ,Microsoft,0
23,Apple and Microsoft representatives are set to join a meeting on Monday promoting patient access to health data ,Microsoft,1
26,Microsoft shows how it wants apps to look on its new dual-screen computers ,Microsoft,1
27,"China cares as deeply about A.I. ethics as the US, Microsoft CEO says, as he calls for global rules ",Microsoft,1
30,How Microsoft's new carbon-negative plan will test the idea of a climate economy ,Microsoft,1
31,Here's what streaming video game services from Google mean for the Sony-Microsoft console wars. ,Microsoft,0
32,"Microsoft CEO's recommends these 2 morning rituals to help ""orient yourself for the day."" (via @CNBCMakeIt)",Microsoft,1
33,"In this #CNBCClassic clip from 2000, Bill Gates announces he is stepping down as CEO after building Microsoft into the most powerful company in the world.",Microsoft,1
34,"Why Microsoft, Google and Apple want you to ditch your password ",Microsoft,1
35,"In the stock market, it's become Apple, Microsoft and Alphabet vs everyone else ",Microsoft,0
36,"The capitalist system “will fundamentally be in jeopardy” due to climate change, Microsoft CEO Satya Nadella told @MadMoneyOnCNBC's @JimCramer yesterday. ",Microsoft,1
39,Slack shares dip as Microsoft prepares global ad campaign for Teams. ,Microsoft,1
40,Microsoft is bringing out the big guns against Slack with new global ad campaign for Teams ,Microsoft,1
42,"In climate push, Microsoft to erase its carbon footprint from atmosphere. ",Microsoft,1
44,Satya Nadella credits Steve Ballmer for Microsoft's initial push into the cloud ,Microsoft,1
45,COMING UP: @MadMoneyOnCNBC's @JimCramer interviews Microsoft CEO Satya Nadella on the Microsoft campus in Redmond. ,Microsoft,1
48,Apple buys an A.I. start-up that came from Microsoft co-founder Paul Allen's research lab ,Microsoft,1
59,Microsoft calls on Samsung to bring its walkie-talkie technology to workplace smartphones ,Microsoft,1
64,Google sold Android search privileges to the highest bidder in Europe — and Microsoft is losing out ,Microsoft,1
65,"Here are Wednesday's biggest analyst calls of the day: Boeing, Cisco, Microsoft, Southwest &amp; more ",Microsoft,1
66,"Bill Gates says that tax rates on the wealthy were nearly double when Microsoft started and ""it didn't hurt"" them. (via @CNBCMakeIt)",Microsoft,1
67,"Microsoft Azure has an edge over Amazon Web Services at big companies, Goldman Sachs survey says ",Microsoft,1
69,"In Bill Gates' Microsoft days, he thought ""sleeping a lot was lazy""—now he needs 7 hours a night. (via @CNBCMakeIt)",Microsoft,1
70,"Microsoft paid $26 billion for LinkedIn, then mostly left it alone — CEO Jeff Weiner is good with that.",Microsoft,1
71,"Apple, Google, and Microsoft might not be thrilled to know that the employees helping make their tech are sending their own kids to tech-free schools. ",Microsoft,1
73,How to know if your Microsoft account's been hacked: Check here to see if you've been compromised ,Microsoft,1
74,Why Bill Gates' net worth is so high 20 years since stepping down as Microsoft CEO,Microsoft,1
76,"Microsoft, Citi and Walmart are amongst the firms who have made the corporate climate action A list ",Microsoft,1
82,"Companies including Apple, Microsoft and BMW have called for the EU to target so-called patent trolls, who buy up patents in the hope of making a profit through licences or lawsuits ",Microsoft,1
86,Microsoft pledges to be 'carbon negative' by 2030,Microsoft,1
88,"The phenomenon is named for Clippy, the Microsoft Office assistant who never really assisted anyone. ",Microsoft,1
91,"Google parent Alphabet valuation hit $1 trillion, joins Apple, Microsoft",Microsoft,1
105,Xbox Game Pass makes a strong case for Microsoft’s game subscription service ,Microsoft,1
109,"Microsoft pledged a carbon-free future. A couple hours later, it fired up its diesel generators. ",Microsoft,1
110," Listen: In today’s What’s News podcast, our journalists break down strong results from Facebook, Microsoft and Tesla, and increasing investor concern over the new coronavirus outbreak ",Microsoft,1
111,"Facing probes and growing public backlash, leaders at Microsoft, Apple, Google and Facebook call for new laws ",Microsoft,1
115,Amazon and Microsoft are trading barbs as they wrestle for supremacy of the $266 billion cloud-computing market,Microsoft,1
117,"Microsoft cloud revenue regains momentum, sending profit above Street estimates ",Microsoft,1
120,"Cloud, Windows sales power Microsoft earnings above Wall Street estimates ",Microsoft,1
122,ICYMI: Microsoft President @BradSmi says an all-out ban on facial recognition technology would have a downside for do-gooders #wef20 #reutersdavos,Microsoft,1
127,"Alphabet CEO backs temporary ban on facial-recognition, Microsoft disagrees ",Microsoft,1
130,"Microsoft creates a 'Climate Innovation Fund,' which will invest $1 billion over the next four years to speed up the development of carbon removal technology",Microsoft,1
135,"Alphabet's market capitalization topped $1 trillion shortly before trading closed. The Google parent joins Microsoft, Amazon and Apple in having crossed that threshold",Microsoft,1
136,"Microsoft to erase its carbon footprint, past and future, in climate push ",Microsoft,1
144,Can Microsoft's 'moonshot' carbon goal succeed? ,Microsoft,1
145,"Microsoft reported better-than-expected earnings and revenue for the three months ending in December, easily beating analysts' estimates and sending its stock up 3% in after-hours trading",Microsoft,1
151,Microsoft wants to eradicate its carbon footprint by 2050,Microsoft,1
165,"New data obtained through a freedom of information request shows the widespread extent of Ontario's ""hallway medicine"" problem, something that Premier Doug Ford has promised to end. ",Ford,0
166,"In an email on Sunday, the office of Ontario Premier Doug Ford confirmed the alert about the Pickering nuclear plant was a mistake. ",Ford,0
167,Ford died at home on Sunday of cancer. She was 85.,Ford,0
168,"The Ford matriarch died, at the age of 85, surrounded by her family and friends in Etobicoke.",Ford,0
169,"John Ford: His 10 greatest films, from Fort Apache to The Searchers",Ford,0
174,10 best movies ever made by John Ford,Ford,0
178,Car Review: Ford Puma – fun drive that’s the cat’s whiskers ,Ford,0
180,Ford and EV start-up Rivian plan to produce an all-electric vehicle for Lincoln ,Ford,1
181,Ford’s Mustang Mach-E is part of the company’s $11 billion plan to develop 40 new all-electric and hybrid models by 2022.,Ford,1
182,"Ford expects $2.2 billion pretax hit due to pension plans, retirement benefits in Q4",Ford,1
183,"WATCH: @andrewrsorkin moderates our “Valuing Unicorns” panel live from Davos, with panelists including Goldman Sachs CEO David Solomon, NYSE President Stacey Cunningham and General Atlantic CEO William Ford. #Davos2020",Ford,0
184,"Tesla shares surge as Musk dances his way into China; market cap approaches combined value of GM, Ford ",Ford,1
185,"Iran retaliation, Ford sales and service sector data: 3 things to know for Monday",Ford,1
188,"McQueen drove the Ford Mustang in the classic film, in which he played no-nonsense police Lieutenant Frank Bullitt ",Ford,1
189,Steve McQueen's Ford Mustang from Bullitt sells for $3.4m at auction,Ford,1
191,Hundreds of Central American migrants ford river to enter Mexico ,Ford,0
196,"Donald Trump is the most unpopular president since Gerald Ford to run for reelection—but his fate is hardly sealed. More, via @FiveThirtyEight: ",Ford,0
198,Review: A gorgeous “Ford v Ferrari” demands a drive to the theater ,Ford,1
199,"The Shelby Mustangs that came out of the Hertz collaboration with Ford were rare enough. The ones with manual transmissions, even rarer. ",Ford,1
201,With a fleet of electrified SUVs hitting the market in 2020—including Ford's battery-electric Mustang Mach-E and Toyota's plug-in RAV4—the auto industry is seeking better returns on its investment in plug-in technology,Ford,1
203,"No one believes them, but this family that collects Ford Mustangs is actually named Speed ",Ford,1
204,Ford to resume production at China joint venture with Changan on February 10,Ford,1
206,Ford expects $2.2 billion pre-tax hit related to pension plans in fourth quarter,Ford,1
216,Ford Mustang driven by Steve McQueen in 'Bullitt' sells for $3.4 million,Ford,1
218,"Tesla stock worth more than GM, Ford combined ",Ford,1
223,Tesla's market value eclipses GM and Ford - combined! ,Ford,1
224,Ford quarterly sales slip on slowdown in passenger cars demand ,Ford,1
226,Ford U.S. sales fall 1.3% in fourth quarter,Ford,1
227,"Rivian, a Michigan-based startup backed heavily by Ford and Amazon, will develop a new electric vehicle for Ford's Lincoln luxury brand ",Ford,1
229,"Facebook, Ford and other high-profile companies have told their employees not to travel to China as the deadly coronavirus continues to spread ",Ford,1
230,"Last weekend, three 2017 model year Ford GT supercars were sold at auctions in Arizona for an average of $1.2 million apiece, more than double the base sticker price of $450,000.",Ford,1
232,"Steve McQueen's iconic car from the 1968 film ""Bullitt"" just became the most valuable Ford Mustang ever sold at auction. The Ford Mustang GT, made famous by the movie's 11-minute car chase, went for $3.7 million, including auction fees.",Ford,1
237,"Ford’s transformation of Michigan Central station is part of the bigger resurgence of Detroit, as it tries to reinvent itself to draw new jobs and new residents ",Ford,1
238,"In Opinion Our columnist @NickKristof is talking with Darren Walker, president of the Ford Foundation ",Ford,0
239,"New for subscribers: Watch Nelson Peltz discuss GE, Trump's trade policies and socially responsible investing ",GE,1
240,"Bank of America upgrades GE, says earnings give it 'more confidence' in the turnaround story ",GE,1
241,GE shares rise after earnings top expectations ,GE,1
243,FDA issues cybersecurity warning on GE medical equipment that monitors patients ,GE,0
246,JP Morgan's Stephen Tusa on GE's recent rally: 'The price is wrong' ,GE,1
247,"GE shares jump 10% on profit beat, higher 2020 cash target",GE,1
248,GE to halve 737 MAX engine deliveries but raises cash target,GE,1
249,"GE beats profit, cash flow estimates on strong aviation business ",GE,1
253,‘We won’t be uprooted’: Mayor says #Trump’s plan to make Abu Dis new #Palestinian capital ‘not fair or honest’ ,DIS,0
254,"""We completely reject the idea that Abu Dis should become the capital of Palestine."" - Ahmad Abu Hilal, mayor of Abu Dis ",DIS,0
255,"Trump's Middle East plan has proposed making the town of Abu Dis, a small village outside of Jerusalem, the capital of a future Palestinian state. Our reporter @arwaib is in Abu Dis speaking to Palestinians on what they think of Trump's proposal ",DIS,0
256,'We will never be Jerusalem': Abu Dis pours scorn on Trump plan ,DIS,0
259,"Abu Dis, an unlikely capital for a future Palestinian state ",DIS,0
262,Netanyahu says proposed Palestinian capital will be in Abu Dis ,DIS,0
263,Sky's deal could prevent rivals Virgin and BT from offering Disney+ packages ,Disney,1
265,Disney is making a live-action version of Bambi ,Disney,1
266,Disney plans to start shooting Bambi as next live-action remake ,Disney,1
271,"30 best Disney films, ranked",Disney,0
273,Disney+ UK launch date and price announced ,Disney,1
274,Disney drops the word 'Fox' from 20th Century Fox name,Disney,1
276,New Star Wars film already in the works – and Disney knows who it wants as director ,Disney,1
286,Star Wars: Rise of Skywalker actor calls for Disney to release director JJ Abrams' cut ,Disney,1
289,Star Wars actor wants Rise of Skywalker director's cut amid claims of 'meddling' from Disney ,Disney,1
290,JJ Abrams reportedly left 'devastated' by Disney's final cut of Star Wars ,Disney,1
291,"After just four years and five movies, Disney has driven ‘Star Wars’ franchise into the ground Op-ed by Zachary Leeman ",Disney,1
292,"Disney unapologetically banked on lame nostalgia, while introducing cardboard cutout new characters meant to do little more than appeal to woke social media mobs Op-ed by Zachary Leeman ",Disney,1
294,Airbnb hires Disney veteran to lead Experiences division ahead of expected public listing this year ,Disney,1
295,'Game of Thrones' star sings Disney's 'Let It Go' in Super Bowl ad for Audi ,Disney,1
296,Disney has closed its Shanghai and Hong Kong parks amid the spread of the coronavirus. Here’s how the outbreak could impact the entertainment industry. ,Disney,1
298,"Disney, McDonald’s, Starbucks and other U.S. companies with significant footprints in China are suspending operations and instituting travel restrictions as they respond to the ongoing outbreak of the coronavirus. ",Disney,1
302,"What to watch today: Coronavirus closes Shanghai Disney, tech layoffs and Stumpf banking ban ",Disney,1
303,Disney+ will launch in Europe a week earlier than planned ,Disney,1
304,Disney's virtual reality jacket can make you feel buff without hitting the gym. ,Disney,1
305,"Disney ditches Fox name from branding, emails and logos ",Disney,1
309,"Disney's streaming business is already worth more than $100 billion alone, investors believe",Disney,1
310,"'Missing Link' upsets Disney, takes home best animated feature at 2020 Golden Globes",Disney,1
311,Here’s where to save (and splurge) when visiting Disney World. ,Disney,1
313,"Everything we know about Disney+'s upcoming ""Willow"" sequel ",Disney,1
314,"Everything we know about Disney's new ""Mighty Ducks"" TV series ",Disney,1
316,"Etsy stores are now selling ""Baby Alien Plush Dolls"" after Disney issues take down notices ",Disney,1
317,The creators and the voice actors of the Owl House spoke to Newsweek about Disney's eerie new show ,Disney,1
318,"When is ""WandaVision"" coming to Disney+? ",Disney,1
321,Disney+: All the details of UK launch revealed ,Disney,1
324,Disney+ streaming service to launch earlier in UK on 24 March,Disney,1
326,"Netflix faces crunch year as Disney, Apple and more vie for streaming crown ",Disney,1
328,"If you're waiting for Disney to #ReleaseTheJJCut, don't hold your breath.",Disney,1
329,"US man confesses to killing wife, 3 children, pet dog in Disney-built community",Disney,1
330,"Disney celebrates #ChineseNewYear as ""Year of the Mouse."" -- ""It makes Chinese culture more accessible to Americans"" ",Disney,1
331,"In traditional Chinese-style costumes, Mickey and Minnie Mouse kicked off #ChineseNewYear season at Disney's California Adventure Park ",Disney,1
332,"1.325 bln dollars at global box office! #Frozen2 is now the highest grossing animated film of all time, followed by ""Frozen"" &amp; ""Incredibles 2"" Top 3 are all under @Disney banner",Disney,1
333,Perspective: Five things we’d like to see in a revamped Obi-Wan Kenobi series on Disney Plus ,Disney,1
334,"Disney to remove ""Fox"" from 20th Century film studio name",Disney,1
335,"Service dogs are hard workers, but that doesn't stop them from being adorable, too—especially when they're helping their owners at Walt Disney World. ",Disney,0
336,These sisters had a supercalifragilisticexpialidocious time after they dancing and skipping with Mary Poppins and Bert at Disney World! ,Disney,0
340,Walt Disney said it is temporarily closing its Disneyland and Disneytown parks in Shanghai as the death toll from China’s spreading coronavirus rose ,Disney,1
341,"Heard on the Street: Netflix and Disney face an early test in coming reports, but the true impact of competition will remain unclear for some time ",Disney,1
342,"The Twentieth Century Fox movie studio, which Disney acquired last year, will become Twentieth Century Studios ",Disney,1
343,Verizon subscriber addition beats estimates on Disney+ boost ,Disney,0
344,Shanghai Disney shuts to prevent spread of virus ,Disney,1
350,Netflix membership growth lagged in the U.S. and Canada amid pricing changes and competition from streamers including Disney+ and AppleTV+ ,Disney,1
353,British royal Meghan signed deal with Disney: Times report ,Disney,1
354,"Apple, Alibaba, Disney and Visa would be nowhere without the Taiwan Semiconductor Manufacturing Company ",Disney,1
355,Disney was responsible for eight of the ten highest grossing films of 2019. Seven of them took in over $1bn worldwide,Disney,1
356,Disney's success owes less to its cinematic brilliance than to shrewd acquisitions ,Disney,1
359,Among the sites closed in China due to the Wuhan coronavirus: • The Forbidden City • A section of the Great Wall of China • Shanghai Disney Resort • McDonald's restaurants in five cities • The Bird's Nest stadium • National Museum of China ,Disney,1
360,Disney is closing down its mega theme park in China over the Lunar New Year holiday as fears grow over the deadly Wuhan virus. ,Disney,1
361,Shanghai Disneyland is shutting down due to the Wuhan coronavirus outbreak. Disney has not said when the park will reopen. ,Disney,1
362,Disney heir Abigail Disney testified Wednesday before the California State Senate in support of a bill that would raise the state's corporate income tax rates while incentivizing firms to curb CEO pay. ,Disney,1
364,"Disney is dropping the ""Fox"" name from its ""20th Century Fox"" brand, renaming the longtime studio as just ""20th Century Studios."" Its art house production company, Fox Searchlight, will now be known as ""Searchlight Pictures.""",Disney,1
365,Today's top business headlines: - Trump signs phase one trade deal with China - Women at Citibank earn 27% less than men - 'Rise of Skywalker' joins Disney's 2019 billion dollar club,Disney,1
368,"This Alpine village, rumored to have inspired the setting of Disney's ""Frozen"" movies, has just 780 residents. But its tourist numbers reportedly reach some 10,000 visitors a day.",Disney,0
371,"“My kids are going to be so jealous."" 14 self-described Disney superfans — out of 10,000 who applied — are going to spend the next year working for Disney (for free). Here's why.",Disney,1
373,Pilots union files suit to halt American Airlines flights to China ,American Airlines,1
374,American Airlines' pilots union says Boeing CEO's comments on the 737 Max were too optimistic,American Airlines,1
375,"American Airlines is cancelling some of its U.S.-China flights as the coronavirus spreads, starting Feb. 9.",American Airlines,1
377,American Airlines cancels some China service for more than a month as coronavirus spreads ,American Airlines,1
378,"Stocks making the biggest moves midday: Estee Lauder, Wynn Resorts, Clorox, American Airlines &amp; more ",American Airlines,1
380,"LISTEN NOW: The CEOs of both Southwest and American Airlines discuss the impact of the ongoing 737 Max grounding. Learn more on the @SquawkStreet PODCAST with @carlquintanilla, @JimCramer and @DavidFaber. Listen and subscribe here:",American Airlines,1
381,"“We’re obviously disappointed to see the return to service date likely moving back,” American Airlines CEO Doug Parker says about the 737 Max. Despite the ongoing grounding, American posted higher profits in Q4.",American Airlines,1
382,American Airlines posts slight earnings beat despite Max problems ,American Airlines,1
387,"Stocks making the biggest moves after hours: American Airlines, Microchip, Pier 1 &amp; more",American Airlines,1
388,American Airlines reaches deal with Boeing over 737 Max grounding compensation,American Airlines,1
390,American Airlines plans to share Boeing 737 Max compensation with employees,American Airlines,1
391,"Are flights to China canceled due to the coronavirus? See the latest updates for United, Delta and American Airlines ",American Airlines,1
392,"United Airlines canceled two dozen US flights to and from China, the carrier announced Tuesday, as American health authorities stepped up efforts to battle the spreading coronavirus. ",American Airlines,1
393,Some global airlines suspend travel over coronavirus fears as American evacuees return from China ,American Airlines,0
395,Woman sues American Airlines alleging employee stalked her with sexually suggestive text messages during flight. ,American Airlines,1
397,"Starbucks, American Airlines and Google are some of the companies to have scaled back operations in China as the government tries to control the spread of coronavirus #WSJWhatsNow",American Airlines,1
398,"American bumped more than 15,000 passengers in a year. Delta bumped nine. Guess who finished last in the WSJ Airline Scorecard for the third time in five years.",American Airlines,1
402,American finished last in the WSJ Airline Scorecard for the third time in five years ,American Airlines,1
408,American Airlines joins others in suspending some China flights as demand sags ,American Airlines,1
409,American Airlines beats quarterly profit estimates on strong travel demand ,American Airlines,1
414,"The Allied Pilots Association, a union representing 15,000 American Airlines pilots, has sued the company to halt the carrier's U.S.-China service, citing ""serious, and in many ways still unknown, health threats posed by the coronavirus""",American Airlines,1
416,"US airlines are giving customers more time to change their flights to China without incurring fees as the deadly coronavirus continues to spread, and as American authorities raise travel precautions for the country. ",American Airlines,1
418,"""Misunderstandings"" Resolved, Akali Dal To Support BJP In Delhi Polls ",DAL,0
420,"Rising food inflation makes rural India turn to rotis, watery dal ",DAL,0
421,"#RepublicDay | CPWD horticulture tableau's theme is 'Kashmir se Kanyakumari'-shows memorial of Swami Vivekananda Kanyakumari, a 'Shikara' on the Dal lake and the Sanchi Stupa, Madhya Pradesh. (ANI) #RepublicDayIndia #RepublicDay2020 #RepublicDayParade2020",DAL,0
422,"Rashtriya Janata Dal to contest Delhi polls in alliance with Congress, candidate list today. ",DAL,0
423,"Clashes between Bajrang Dal, Durga Vahini workers and security forces near Pakistan Embassy in #Delhi during protest against mob attack on #NankanaSahib Gurdwara on January 3. Police detained protesters: news agency ANI. More on",DAL,0
424,Row over booklet circulated by Congress Seva Dal in Madhya Pradesh. ,DAL,0
425,Teachers sue after Delta Air Lines plane dumps fuel on schools ,Delta Air Lines,1
427,A Delta Air Lines plane slid off an icy runway Friday morning with its front wheel impacting the grass. The aircraft was taxiing to be de-iced in preparation for departure when the incident occurred ,Delta Air Lines,1
430,Teachers doused in jet fuel at California school sue Delta Air Lines ,Delta Air Lines,1
433,Delta Air Lines sued by California teachers over fuel dump ,Delta Air Lines,1
434,Delta Air Lines plans to replace the uniforms that hundreds of its employees complain are causing health problems ,Delta Air Lines,1
435,"Delta Air Lines is temporarily reducing its number of weekly flights between the US and China “due to significantly reduced customer demand prompted by global health concerns related to coronavirus,” the airline said in a statement ",Delta Air Lines,1
437,"The US Department of Transportation ordered Delta Air Lines to pay a $50,000 fine to settle allegations it violated federal law by discriminating against Muslim passengers",Delta Air Lines,1
438,Frustrated community members questioned government officials and Delta Air Lines representatives during a meeting to talk about a fuel dump from a plane making an emergency landing near Los Angeles this week. ,Delta Air Lines,1
439,"Four teachers from a California elementary school that was doused by fuel dumped from a Delta Air Lines plane making an emergency landing are suing the airline, alleging negligence, attorney Gloria Allred said ",Delta Air Lines,1
